tarde_Opposition_universelle.pdf	193	où, imitativement, elle a fait son chemin longtemps avant d'éclater en émeu-		
tarde_Opposition_universelle.pdf	196	tenir grand compte de la diffusion imitative, dans le public consommateur, du		
tarde_Opposition_universelle.pdf	197	hier luxueux, demain vulgaire, descend imitativement, sympathiquement à		
tarde_Opposition_universelle.pdf	203	c'est que les agents de l'assimilation imitative des classes et des peuples, qui		
tarde_Opposition_universelle.pdf	210	sion imitative de la religion combinée avec celle de la langue, des usages, des		
tarde_Opposition_universelle.pdf	210	sés et crénelés entre états, elle a laissé le champ libre au rayonnement imitatif		
tarde_Opposition_universelle.pdf	215	grâce à la sympathie imitative, se répand contagieusement	 dans les esprits. Il	
tarde_psycho_economique_t1.pdf	4	   II.   Tendance de tout exemple au rayonnement imitatif. Expansivité		
tarde_psycho_economique_t1.pdf	13	             Tendance de tout exemple au rayonnement imitatif.		
tarde_psycho_economique_t1.pdf	14	j'appelle un rayonnement imitatif, - c'est-à-dire en un éventail indéfiniment		
tarde_psycho_economique_t1.pdf	14	allongé de rayons rattachant chaque imitateur, par une chaîne d'intermédiaires, au		
tarde_psycho_economique_t1.pdf	15	est visible que, sans une rencontre de rayons imitatifs différents dans un cerveau		
tarde_psycho_economique_t1.pdf	17	d'innombrables croisements, des interférences de rayons imitatifs dans des		
tarde_psycho_economique_t1.pdf	19	tendance à l'expansion imitative des exemples jugés bons, des idées jugées		
tarde_psycho_economique_t1.pdf	21	toujours, ni le plus souvent, d'une reproduction imitative, car, si, par exemple,		
tarde_psycho_economique_t1.pdf	21	sont imitatives. Les choses qui se répètent par imitation (mots d'une langue, rites		
tarde_psycho_economique_t1.pdf	21	remarque un grand nombre de similitudes non imitatives, approximatives. Or, de		
tarde_psycho_economique_t1.pdf	22	    Paris, de New-York. C'est là une répétition non imitative. Mais elle n'aurait pu avoir lieu, si en		
tarde_psycho_economique_t1.pdf	23	débouchés extérieurs, du rayonnement imitatif et expansif dont les foyers de la		
tarde_psycho_economique_t1.pdf	26	rayonnement imitatif, soit en fait d'institutions politiques, soit en fait de besoins,		
tarde_psycho_economique_t1.pdf	26	rayonner imitativement dans tous les sens, à l'Ouest, à l'Est, au Sud, au Nord. La		
tarde_psycho_economique_t1.pdf	33	sociale, n'est-ce pas l'invention, j'entends l'invention viable, imitable, qui		
tarde_psycho_economique_t1.pdf	41	c'est-à-dire les inventions et leurs imitations. Les lois de l'imitation comme les lois		
tarde_psycho_economique_t1.pdf	42	laissant expliquer par des emprunts et des imitations cachées si l'on fait des		
tarde_psycho_economique_t1.pdf	43	peuvent s'expliquer par une commune descendance imitative), sont attribuées en		
tarde_psycho_economique_t1.pdf	43	     expliquer la propagation imitative des superstitions dont il s'agit d'Italie en Gaule ou de Gaule		
tarde_psycho_economique_t1.pdf	44	j'établis entre les similitudes par imitation et les similitudes par nécessité logique.		
tarde_psycho_economique_t1.pdf	44	descendance imitative d'un même modèle est, en effet, l'équivalent social de la		
tarde_psycho_economique_t1.pdf	45	     Quant aux similitudes non par imitation mais par contrainte logique - ou		
tarde_psycho_economique_t1.pdf	49	sources de l'énergie imitative, qui sont les inventions et initiatives individuelles de		
tarde_psycho_economique_t1.pdf	49	l'énergie imitative, de la vitalité sociale des peuples, dès que leur génie inventif		
tarde_psycho_economique_t1.pdf	58	de légiférer ici consiste en imitations rayonnantes de proche en proche à partir		
tarde_psycho_economique_t1.pdf	58	d'initiatives individuelles, en rencontres de ces rayonnements imitatifs et en		
tarde_psycho_economique_t1.pdf	74	entend leur diffusion, ce qui suppose la propagation imitative du désir qu'on a de		
tarde_psycho_economique_t1.pdf	75	de la répétition imitative des besoins, des travaux, des intérêts et de leur		
tarde_psycho_economique_t1.pdf	75	par imitation avec la propagation des hommes eux-mêmes par génération, car le		
tarde_psycho_economique_t1.pdf	75	mais par rayonnement imitatif ; car la seule différence, à cet égard, entre l'art		
tarde_psycho_economique_t1.pdf	76	proprement dite est une répétition - imitation seulement.		
tarde_psycho_economique_t1.pdf	84	l'homme 	 de là les onomatopées, les harmonies imitatives, etc., c'est là la source.	
tarde_psycho_economique_t1.pdf	105	universelle, ondulation, génération, imitation, sont mises en jeu à la fois. Il		
tarde_psycho_economique_t1.pdf	108	par imitation égalitaire - qui finit par vaincre les résistances du patron. Bien des		
tarde_psycho_economique_t1.pdf	109	cette imitation de soi-même qu'on nomme habitude chez les individus ou coutume		
tarde_psycho_economique_t1.pdf	118	propageant imitativement des premiers qui les ont faites aux individus de leur		
tarde_psycho_economique_t1.pdf	119	genèse des inventions, et les lois de leurs imitations. Le progrès économique		
tarde_psycho_economique_t1.pdf	120	propagation imitative des lois qui les régissent ; et quelles sont ces lois ?		
tarde_psycho_economique_t1.pdf	135	habituels des rayonnement imitatifs, c'est-à-dire à la Cour sous l'ancien régime,		
tarde_psycho_economique_t1.pdf	144	courants imitatifs, étaient destinées à lutter non contre le penchant à l'introduction		
tarde_psycho_economique_t1.pdf	144	contagion imitative du luxe des grands pour que la distance ne vienne pas à		
tarde_psycho_economique_t1.pdf	158	et déjà vaincus par ces moyens. Tout est imitation et reproduction dans le travail		
tarde_psycho_economique_t1.pdf	158	n'y a-t-il rien de plus parfaitement imitatif, de plus exactement conformiste que		
tarde_psycho_economique_t1.pdf	158	de reproduction imitative, et une toute petite part d'ingéniosité, qui sert de ferment		
tarde_psycho_economique_t1.pdf	159	par une impulsion instinctive, innée, secondairement par imitation, tandis que les		
tarde_psycho_economique_t1.pdf	159	autres consistent en actes et en buts qui se répètent par imitation avant tout. Mais,		
tarde_psycho_economique_t1.pdf	194	du fonctionnement imitatif de toutes les consommations et de toutes les		
tarde_psycho_economique_t1.pdf	196	triomphé par sélection imitative.		
tarde_psycho_economique_t1.pdf	202	extérieure de la mémoire, imitation interne.		
tarde_psycho_economique_t1.pdf	219	au règne de la monnaie, sous l'impulsion de la sympathie imitative sans cesse		
tarde_psycho_economique_t1.pdf	245	89 Autre exemple de cette formation imitative. « L'instruction du cautionnement consenti par des		
tarde_psycho_economique_t1.pdf	254	besoins et des travaux, par l'effet de l'habitude, cette imitation de soi-même. Cette		
tarde_psycho_economique_t1.pdf	255	élargissement graduel, qui correspond à la propagation imitative des besoins et		
tarde_psycho_economique_t1.pdf	255	propagées, entre-croisant leurs irradiations imitatives indéfiniment multipliées, et		
tarde_psycho_economique_t2.pdf	21	     de prospérité purement laborieuse, adonnés au développement imitatif de grandes inventions		
tarde_psycho_economique_t2.pdf	35	nécessairement la vie de sympathie imitative. Le négociant ou l'industriel le plus		
tarde_psycho_economique_t2.pdf	41	parvenue à l'un des vendeurs ou à l'un des acheteurs, il y a diffusion imitative de		
tarde_psycho_economique_t2.pdf	55	par suite de la contagion imitative, la demande de cet article diminuerait,		
tarde_psycho_economique_t2.pdf	59	être imitées et doivent leur fécondité à leur imitation même. Plus elles débordent,		
tarde_psycho_economique_t2.pdf	75	émulation imitative. Il faut seulement remarquer que l'imitation de clan à clan, de		
tarde_psycho_economique_t2.pdf	88	défensive contre les empiètements imitatifs du vulgaire ? Il est curieux de voir, en		
tarde_psycho_economique_t2.pdf	96	d'être question. Partout ces monnaies, procèdent, dit Lenormant, « d'une imitation		
tarde_psycho_economique_t2.pdf	113	la contagion imitative est vraiment la cause du mal, mais le cas est si rare, et le		
tarde_psycho_economique_t2.pdf	114	    Ces crises de surproduction sont dues à des entraînements imitatifs qui		
tarde_psycho_economique_t2.pdf	118	engouement imitatif ; tandis que les crises-luttes s'expliquaient par un grand		
tarde_psycho_economique_t2.pdf	119	d'entraînement imitatif, par quelle foule d'actions intermentales, s'entretient cette		
tarde_psycho_economique_t2.pdf	156	rayonnement imitatif du confort ou du luxe de la bourgeoisie a suscité le besoin		
tarde_psycho_economique_t2.pdf	165	dire de la propagation imitative des inventions. Aussi le classement des nations,		
tarde_psycho_economique_t2.pdf	195	avant tout, par une suite d'accidents heureux, qui, grâce au rayonnement imitatif et		
tarde_psycho_economique_t2.pdf	195	     leur rayonnement imitatif suivant certaines règles formulables.		
tarde_psycho_economique_t2.pdf	201	de s'accroître 	 1° l'apparition de nouvelles inventions ; 2° le rayonnement imitatif	
tarde_psycho_economique_t2.pdf	288	forme du travail et de la richesse tend à se multiplier par répétition imitative, et il		
tarde_psycho_economique_t2.pdf	289	répétitions multipliantes, l'une par génération, l'autre par imitation, ce serait donc		
tarde_psycho_economique_t2.pdf	293	découle même des lois de l'imitation - que l'envie imitative des besoins d'en haut		
taylor_democracy_citizen_efficacy.pdf	30	               of elsewhere to which shoppers are linked. In artful imitations, even including a careful treatment of		
Terranova._foucault_2009.pdf	22	      tion and imitation. (Lazzarato, 2002	 27)	
Theberge_network_studio_2004.pdf	9	of popular music aesthetics that algorithmic imitations of them were		
thrift-1999-place-of-complexity.pdf	6	      imitate the world as it really is. As Benjamin noted, `Perhaps there is none of		
thrift_automatic_space_2002.pdf	20	   imitate or reflect or correspond or map directly to an         entity in the direction of this question and redefin-		
Thrift-electric-animals-2004.pdf	1	 rt of man, as in many other things, so in this also imitated, that it can make		
Thrift-electric-animals-2004.pdf	7	  nature and then imitates or takes inspiration from these designs and		
Thrift-electric-animals-2004.pdf	7	d display obvious utility if they could be imitated, such as the sticking		
Thrift-electric-animals-2004.pdf	7	 he second approach focuses on imitation. Over the last ten years or so		
Thrift-electric-animals-2004.pdf	22	er, W. (1950) ‘An imitation of artificial life’, Scientific American, vol. 96, pp.		
Thrift_-_reso163554.pdf	3	and are able to circulate easily through a semiconscious process of imitation		
Thrift_-_reso163554.pdf	21	rather than discipline and imitation rather than coercion	 ‘the paradigmatic	
Thrift_-_reso163554.pdf	27	Leys, R. (1993) ‘Mead’s voices	 imitation     Princeton, NJ	 Princeton University
Thrift-TechUnconscious-2004.pdf	7	     banished entirely under the regime Prince Maurice and his imitators established,		
thrift-thicktime-organization-2005.pdf	1	      of progressive practical imitation, in the manner of tarde. this argument		
thrift-thicktime-organization-2005.pdf	4	     imitation as they are perceived/judged to be successful according to		
thrift-thicktime-organization-2005.pdf	4	     seen as constantly changing fields through which imitation periodically		
thrift-thicktime-organization-2005.pdf	5	while, but they were soon imitated and, as they became ubiquitous, so		
thrift-thicktime-organization-2005.pdf	5	argue that other innovations are less prone to this kind of imitation since		
Timmermans_A_World_of_Standards.pdf	18	        and imitation. Organization 15	563–83	
Toew_Tarde.pdf	11	and interferences between imitative currents’ (1994	 314). Now, to be sure,	
Toew_Tarde.pdf	12	that imitation can be at a great historical distance and that it is therefore		
Toew_Tarde.pdf	12	purely affect-based collective phenomenon. In Tarde’s view, imitation		
tsing_supply_chain_capitalism_2009.pdf	27	agendas even as they imitate American style. Yet even in going their own way, they		
tsing_supply_chain_capitalism_2009.pdf	43	of Newell Rubbermaid‟s office in Bentonville was guided by the principle that imitation		
ulhmann_deleuze_image_2004.pdf	4	examining what is presented and filtering it,         There is no imitation involved in sucb created		
ulhmann_deleuze_image_2004.pdf	6	suggestion that, in good films, these images are     within cinema history hut through the imitation		
VoiceChips.pdf	10	children to imitate technological effects. These are voice mask for putting on the accent of techno		
VoiceChips.pdf	13	then there is the multitude of imitative toys that emulate cute animals, non functional power tools		
Williams_subjectivity.pdf	9	acknowledges the value of the principle of affective imitation in Spinoza’s		
Williams_subjectivity.pdf	12	             there will always exist an unconscious affectus imitatio within the process of		
Williams_subjectivity.pdf	12	             hope and envy become not just relations of recognition and imitation whereby		
Williams_subjectivity.pdf	14	             ways. The imitative structure discussed in Spinoza’s philosophy is not simply		
