tarde_les_lois_sociales.pdf	68	rence heureuse de deux imitations, dans un seul esprit d'abord ; et la tendance de cette		
tarde_les_lois_sociales.pdf	68	dant, mais encore de s'accoupler logiquement, grâce à cette diffusion imitative, avec		
tarde_logique_sociale_part_1.pdf	4	Langues, chose éminemment imitative et logique. Leur évolution multilinéaire. Qua-		
tarde_logique_sociale_part_1.pdf	5	Religion, comme langue, chose imitative et logique. Le sentiment générateur. Sa		
tarde_logique_sociale_part_1.pdf	5	confondre l'invention dans le travail, qui est tout imitation. Différences radicales entre		
tarde_logique_sociale_part_1.pdf	10	de modèles en un mot, objets de son imitation spontanée ou obligatoire, consciente ou		
tarde_logique_sociale_part_1.pdf	10	haineuse, admirative ou envieuse, mais de son imitation toujours. C'est la pierre de		
tarde_logique_sociale_part_1.pdf	63	diffusion imitative des idées et d'équilibration ascendante des croyances. Ceux que la		
tarde_logique_sociale_part_1.pdf	63	scientes, la foule des imitateurs est une espèce de somnambule, pendant que, par son		
tarde_logique_sociale_part_1.pdf	77	de cet homme et la crédulité imitative de ses semblables. L'objet auquel la vision de		
tarde_logique_sociale_part_1.pdf	89	     créations. L'orgueil précède la gloire, qui n'est que son rayonnement imitatif en quelque sorte.		
tarde_logique_sociale_part_1.pdf	92	(ou sans notoriété, petite ou grande), point d'imitation, et, sans imitation, point de		
tarde_logique_sociale_part_1.pdf	94	sivement célèbres, mais surtout entre les diverses imitations prolongées dont chacune		
tarde_logique_sociale_part_1.pdf	122	ques, linguistiques, quelconques, toutes nées de contagions imitatives opérées confor-		
tarde_logique_sociale_part_1.pdf	123	États, le recul des frontières, facilite l'expansion imitative de ces inventions élémen-		
tarde_logique_sociale_part_1.pdf	125	d'émancipation croissante, masques d'une croissante imitation mutuelle, et qu'en		
tarde_logique_sociale_part_1.pdf	126	plus efficace que celle des imitations, c'est-à-dire des inventions en tant qu'imitées.		
tarde_logique_sociale_part_1.pdf	127	jours plus ou moins inattendus. Ajoutons que, très fréquemment, les imitations		
tarde_lois_imitation_1.pdf	4	         universelle	 ondulation, génération, imitation. Science sociale et philosophie	
tarde_lois_imitation_1.pdf	4	         sans imitation ? Preuves du contraire 57-65		
tarde_lois_imitation_1.pdf	5	         exclusivement des éditions imitatives, tirées de chaque invention ancienne		
tarde_lois_imitation_1.pdf	9	est de fonctionner à l'imitativité généralisée ; imitativité à laquelle notre époque		
tarde_lois_imitation_1.pdf	10	     On m'a reproché çà et là « d'avoir souvent appelé imitation des faits auxquels ce		
tarde_lois_imitation_1.pdf	10	profonde des choses -la signification du mot imitation.		
tarde_lois_imitation_1.pdf	11	changerait essentiellement de nature ? - J'entends par imitation toute empreinte de		
tarde_lois_imitation_1.pdf	11	êtres vivants, il y a imitation en ce sens (soit de l'un par l'autre, soit d'autres par les		
tarde_lois_imitation_1.pdf	11	ancestrale, par éducation domestique, par imitation-coutume.		
tarde_lois_imitation_1.pdf	12	est d'être imitatif, est-ce dire, comme certains lecteurs superficiels ont paru le croire,		
tarde_lois_imitation_1.pdf	13	de gens qui présentent entre eux beaucoup de similitudes produites par imitation ou		
tarde_lois_imitation_1.pdf	13	de plus imitatif que de lutter contre son propre penchant à suivre ce courant et		
tarde_lois_imitation_1.pdf	13	adversaires. Distinguons bien entre la propagation imitative des questions et celle des		
tarde_lois_imitation_1.pdf	14	nous leur étions supérieurs, ils ont cessé d'arrêter le rayonnement imitatif de notre		
tarde_lois_imitation_1.pdf	15	autre milieu ethnique le rayonnement imitatif se réfracte; et j'ajoute que cette réfrac-		
tarde_lois_imitation_1.pdf	15	groupe social, est à la fois imitatif et héréditaire. En second lieu, l'invention, d'où je		
tarde_lois_imitation_1.pdf	20	génération, imitation. Science sociale et philosophie sociale. Sociétés animale		
tarde_lois_imitation_1.pdf	21	tendent à s'y propager par imitation forcée ou spontanée, élective ou inconsciente,		
tarde_lois_imitation_1.pdf	21	Tout n'est socialement qu'inventions et imitations, et celles-ci sont les fleuves dont		
tarde_lois_imitation_1.pdf	22	     main-forte. La contagion imitative fait le reste.		
tarde_lois_imitation_1.pdf	24	     Toute répétition, sociale, organique ou physique, n'importe, c'est-à-dire imitative,		
tarde_lois_imitation_1.pdf	26	que social, est imitateur par essence, et que l'imitation joue dans les sociétés un rôle		
tarde_lois_imitation_1.pdf	28	social, sont le fruit direct ou indirect de l'imitation sous toutes ses formes, imitation-		
tarde_lois_imitation_1.pdf	28	coutume ou imitation-mode, imitation-sympathie ou imitation-obéissance, imitation-		
tarde_lois_imitation_1.pdf	29	une imitation, il s'ensuit que, dans l'hypothèse où nul mouvement ne serait ni n'aurait		
tarde_lois_imitation_1.pdf	30	dialecte local, à l'usage de quelques familles, devient peu à peu, par imitation, un		
tarde_lois_imitation_1.pdf	31	parler; étant donné qu'il y a aujourd'hui tels foyers de rayonnements imitatifs et qu'ils		
tarde_lois_imitation_1.pdf	32	réelle à une époque donnée se composent non des rayonnements imitatifs nécessaire-		
tarde_lois_imitation_1.pdf	32	    Comme exemples à l'appui de la progression géométrique des imitations, je		
tarde_lois_imitation_1.pdf	32	sur celle du grand Génois, et a eu à son tour des imitateurs.		
tarde_lois_imitation_1.pdf	34	     Indiquons maintenant un nouvel ordre d'analogies. Les imitations (mots d'une		
tarde_lois_imitation_1.pdf	35	santes en une contagion imitative. Il y a eu, dans ce cas, augmentation de force de		
tarde_lois_imitation_1.pdf	37	force imitateurs. N'est-il pas vrai que, à partir de cette perspective inespérée, il a senti		
tarde_lois_imitation_1.pdf	39	social, d'un puissant entraînement imitatif, ces mêmes phénomènes, toujours les		
tarde_lois_imitation_1.pdf	40	leur étouffement, par l'épanouissement imitatif illimité d'une pensée unique, d'une		
tarde_lois_imitation_1.pdf	40	retrouvé, on l'imprime, on s'en inspire 	 imitation posthume qui n'aurait pas eu lieu si	
tarde_lois_imitation_1.pdf	46	commencé à se répandre par imitation, ont mis leurs imitateurs en goût de découvrir		
tarde_lois_imitation_1.pdf	46	commencé à se répandre par imitation, ont mis leurs imitateurs en goût de découvrir		
tarde_lois_imitation_1.pdf	47	et c'est elle, c'est sa propagation par imitation, qui est la vraie cause, la condition sine		
tarde_lois_imitation_1.pdf	47	propagation, nous devons voir dans cette idée de génie le croisement d'une imitation		
tarde_lois_imitation_1.pdf	48	pour éléments des imitations antérieures, sauf quelques apports extérieurs inféconds		
tarde_lois_imitation_1.pdf	48	suivant la direction et l'étendue du rayon de son imitation à travers des populations		
tarde_lois_imitation_1.pdf	49	par imitation, sa domestication s'est répandue. Mais ce qui est vrai de ce quadrupède		
tarde_lois_imitation_1.pdf	49	suggestion imitative? Même question relativement à l'idée de tailler des silex ou de		
tarde_lois_imitation_1.pdf	49	ces idées par une lente et graduelle imitation qui aurait fini par couvrir presque tout le		
tarde_lois_imitation_1.pdf	49	     encore, dans le même article, ce qui a trait à la diffusion imitative, si étendue, de la croix gammée		
tarde_lois_imitation_1.pdf	50	ou belle. En voici un exemple. Comment, si ce n'est pas imitation, ce grotesque usage		
tarde_lois_imitation_1.pdf	51	commun, et, par suite, des similitudes croissantes, même sans imitation ? Preuves du contraire.		
tarde_lois_imitation_1.pdf	58	on a compris qu'il fallait les assimiler par contagion imitative aux membres de la		
tarde_lois_imitation_1.pdf	58	étroites formées par l'éducation, l'une des formes de la transmission imitative. Voilà		
tarde_lois_imitation_1.pdf	58	distincts d'inventions imitativement rayonnantes dans leur sphère propre, mais il n'y a		
tarde_lois_imitation_1.pdf	59	vement social, mais pourquoi ? Parce qu'elle suppose la similitude par imitation. Et		
tarde_lois_imitation_1.pdf	60	nations tendent à une assimilation imitative beaucoup plus grande, beaucoup plus		
tarde_lois_imitation_1.pdf	61	à mesure que d'autres traits communs se joignent à celui-là, tous d'origine imitative.		
tarde_lois_imitation_1.pdf	64	tendances, d'idées qui se propagent imitativement par des voies différentes, mais se		
tarde_lois_imitation_1.pdf	65	générative ou imitative, est le but.		
tarde_lois_imitation_1.pdf	66	mutuellement. Leur rapport n'était point économique, utilitaire, mais imitatif et social,		
tarde_lois_imitation_1.pdf	66	dire toujours, suppose une sorte d'habitude, une imitation inconsciente de soi-même		
tarde_lois_imitation_1.pdf	68	moins imitatifs en un mot, que nos ancêtres. C'est une erreur, et nous aurons à la		
tarde_lois_imitation_1.pdf	68	ne puisse arriver à lire inconsciemment dans l'esprit par une imitation inconsciente de		
tarde_lois_imitation_1.pdf	69	à nous révéler la passivité imitative de l'être social, en tant que social, c'est-à-dire en		
tarde_lois_imitation_1.pdf	71	Nullement, il devient plus admiratif, plus imitatif que jamais, soumis à l'ascendant ou		
tarde_lois_imitation_1.pdf	72	pas aussi par imitation? Supposez un somnambule qui pousse l'imitation de son		
tarde_lois_imitation_1.pdf	73	qu'être social, c'est donc avant tout être imitatif. Pour innover, pour découvrir, pour		
tarde_lois_imitation_1.pdf	76	propagées par imitation à partir d'un inventeur presque toujours ignoré, multiples		
tarde_lois_imitation_1.pdf	77	opposé, par des inventions non imitables et d'une utilité momentanée, à un ensemble		
tarde_lois_imitation_1.pdf	77	d'inventions indéfiniment imitables et utiles. Quant à susciter directement celles-ci,		
tarde_lois_imitation_1.pdf	77	Parmi les inventions qui s'offrent à son imitation, parmi les découvertes ou idées		
tarde_lois_imitation_1.pdf	78	On voit ainsi les imitations, comme les inventions, s'enchaîner successivement,		
tarde_lois_imitation_1.pdf	79	cantonné dans ses traditions et ses coutumes locales, beaucoup plus imitatif du dehors		
tarde_lois_imitation_1.pdf	81	faveur de la consanguinité et révèle seulement une contagion imitative.		
tarde_lois_imitation_1.pdf	83	éditions imitatives, tirées de chaque invention ancienne ou récente. Analogies et différences		
tarde_lois_imitation_1.pdf	83	des éditions imitatives qu'on en fait ? Seulement l'une traite d'inventions pour la		
tarde_lois_imitation_1.pdf	84	l'aryaque, ou à leur sœur aînée, le sanscrit ; elle remonte péniblement des imitations à		
tarde_lois_imitation_1.pdf	85	force exceptions, ont trait à une progression imitative.		
tarde_lois_imitation_1.pdf	85	     Les imitations réalisées sont nombreuses, mais qu'est-ce auprès des imitations		
tarde_lois_imitation_1.pdf	86	de ses éditions imitatives sans fin, comme la philologie de chaque mot; une archéo-		
tarde_lois_imitation_1.pdf	88	prêtent ou s'opposent ces diverses propagations ou consolidations imitatives de		
tarde_lois_imitation_1.pdf	88	puissance imitative propre à chaque invention, dans un temps et un pays donnés ;		
tarde_lois_imitation_1.pdf	88	faiblement il est vrai, le grand courant imitatif qui porte les habitants des campagnes		
tarde_lois_imitation_1.pdf	91	Mais la propagation imitative de certaines inventions que l'on sait (chemins de fer,		
tarde_lois_imitation_1.pdf	91	    profondeur. Et, par la mutuelle action de ces deux imitations de soi et d'autrui, il n'est pas,		
tarde_lois_imitation_1.pdf	94	l'asservissement imitatif des masses à des fantaisies ou à des conceptions indivi-		
tarde_lois_imitation_1.pdf	94	autre est le désir social, imitatif et raisonné de devenir père. Le premier peut être		
tarde_lois_imitation_1.pdf	99	confluent heureux de deux grands courants imitatifs dont l'un a eu pour source Adam		
tarde_lois_imitation_1.pdf	99	cette époque, le rayonnement imitatif de cette invention est venu interférer en France		
tarde_lois_imitation_1.pdf	103	le progrès de la population ne fera qu'étendre leur clientèle imitatrice ; le progrès de la		
tarde_lois_imitation_1.pdf	104	pour effet d'imposer des conditions nouvelles à la propagation des imitations		
tarde_lois_imitation_1.pdf	104	vrai que, en somme, le destin des imitations est la seule chose qui intéresse l'histoire,		
tarde_lois_imitation_1.pdf	105	    La statistique nous fournit, pour chaque espèce de propagation imitative isolément		
tarde_lois_imitation_1.pdf	105	science, qui régissent toutes les imitations, et, dans ce but, il faut étudier séparément		
tarde_lois_imitation_1.pdf	106	principes déjà établis en lui (par imitation toujours). Ici, il n'y a en présence que des		
tarde_lois_imitation_1.pdf	107	inconnus par voie d'analogie, c'est-à-dire par imitation de soi ou d'autrui 1 ; et c'est		
tarde_lois_imitation_1.pdf	107	le modèle d'italicus, a été un inventeur sans le savoir, mais, en somme, il a été imitatif		
tarde_lois_imitation_1.pdf	107	renom ont créé de toutes pièces, par imitation servile du latin, des mots tels que		
tarde_lois_imitation_1.pdf	111	par imitation aussi que cette haute avidité gagne les intelligences dignes d'elle. Or, les		
tarde_lois_imitation_1.pdf	114	progrès linguistique s'opère toujours, par imitation d'abord, puis par lutte entre deux		
tarde_lois_imitation_1.pdf	121	la propagation même d'une imitation implique sa rencontre et sa lutte avec une autre.		
tarde_lois_imitation_1.pdf	131	invention se répand tranquillement par imitation, ce qui est le fait élémentaire des		
tarde_lois_imitation_1.pdf	131	puisqu'il n'y a que des imitations; mais, puisque ces évolutions, ces imitations, se		
tarde_lois_imitation_2.pdf	4	         universelle	 ondulation, génération, imitation. Science sociale et philosophie	
tarde_lois_imitation_2.pdf	4	         sans imitation ? Preuves du contraire		
tarde_lois_imitation_2.pdf	5	         exclusivement des éditions imitatives, tirées de chaque invention ancienne		
tarde_lois_imitation_2.pdf	9	modalités qui peuvent affecter une imitation quelconque, à savoir son exactitude ou		
tarde_lois_imitation_2.pdf	10	    insurmontable, l'accord en question n'étant possible que par voie de propagation imitative, et non		
tarde_lois_imitation_2.pdf	12	est transmise par imitation 	 avant d'imiter l'acte d'autrui, on commence par éprouver	
tarde_lois_imitation_2.pdf	12	    Cela dit sur les caractères intrinsèques des imitations, occupons-nous des		
tarde_lois_imitation_2.pdf	13	dans la moyenne des cas, à se transmettre par imitation. Cette transmissibilité, relative		
tarde_lois_imitation_2.pdf	13	     La soif n'est-elle pas plus contagieuse par imitation que ne l'est la faim ? Il me le		
tarde_lois_imitation_2.pdf	13	La fonction vocale est éminemment imitative, comme d'ailleurs toutes les fonctions		
tarde_lois_imitation_2.pdf	14	     Les fonctions des sens supérieurs sont plus transmissibles imitativement que		
tarde_lois_imitation_2.pdf	14	     Toutes les passions l'emportent en contagiosité imitative sur les simples appétits,		
tarde_lois_imitation_2.pdf	15	    Toutes les imitations où la logique n'entre pour rien rentrent dans ces deux		
tarde_lois_imitation_2.pdf	15	grandes catégories 	 crédulité et docilité, imitation des croyances et imitation des	
tarde_lois_imitation_2.pdf	17	     On remarquera que l'obéissance et la confiance, imitation intérieure du supérieur		
tarde_lois_imitation_2.pdf	22	une étiquette a dû s'établir, en se fortifiant de plus en plus à chaque imitation dont elle		
tarde_lois_imitation_2.pdf	23	seulement la loi de la propagation imitative de haut en bas, dont nous allons parler,		
tarde_lois_imitation_2.pdf	25	dira pas ici que cette imitation est une opération militaire en vue d'une revanche. C'est		
tarde_lois_imitation_2.pdf	26	il faudrait se garder de croire que la contagion imitative de la politesse et du luxe		
tarde_lois_imitation_2.pdf	28	1    Prévenons une objection. On peut nous opposer qu'en imitant les modes étrangères en fait de		
tarde_lois_imitation_2.pdf	33	    Il n'est pas jusqu'au progrès dans l'égalité qui ne se soit opéré par imitation, et par		
tarde_lois_imitation_2.pdf	34	imite le plus est lui-même imitateur à certains égards de quelques-uns de ses copistes.		
tarde_lois_imitation_2.pdf	34	    les rangs de la noblesse, d'où il est descendu ensuite, et peu à peu, par imitation, dans les rangs de		
tarde_lois_imitation_2.pdf	39	bénéficiaire, les petits vassaux du grand vassal, comme une édition nouvelle imitative		
tarde_lois_imitation_2.pdf	59	cannibalisme serait né originairement par imitation des usages de la chasse primitive,		
tarde_lois_imitation_2.pdf	66	principale raison d'être de faciliter la transmission par imitation des éléments de la		
tarde_lois_imitation_2.pdf	67	applicables, par imitation, à tous les peuples de la terre; le parti tory, au contraire,		
tarde_lois_imitation_2.pdf	68	    imitation libre, extérieure, les ayant d'ailleurs reçues nous-mêmes le plus souvent par imitation de		
tarde_lois_imitation_2.pdf	68	    imitation libre, extérieure, les ayant d'ailleurs reçues nous-mêmes le plus souvent par imitation de		
tarde_lois_imitation_2.pdf	72	par hérédité, mais encore et surtout par une propagation imitative qui a suivi celle-ci		
tarde_lois_imitation_2.pdf	72	dit Tocqueville. Il y a eu là imitation par mode ; et cette mode, assise et enracinée, est		
tarde_lois_imitation_2.pdf	76	et coutumier, c'est-à-dire féodal, du militarisme volontaire, imitatif du dehors et		
tarde_lois_imitation_2.pdf	81	     Eh bien, s'il est vrai que la disposition du public moderne à la libre imitation du		
tarde_lois_imitation_2.pdf	81	que, en France, cette uniformité s'est établie par la propagation imitative de la		
tarde_lois_imitation_2.pdf	88	armes ou des outils de silex, des poteries, etc., s'est propagée par imitation-mode sur		
tarde_lois_imitation_2.pdf	89	l'alternance des deux imitations s'applique à la fois à la propagation des actes		
tarde_lois_imitation_2.pdf	90	de libre imitation du dehors, qui se termine immanquablement par un retour au		
tarde_lois_imitation_2.pdf	90	conséquences en histoire 	 les désirs de consommation se communiquent par imitation	
tarde_lois_imitation_2.pdf	90	    ment canalisée, d'autres où elle s'épanche au dehors, et où les diverses imitations professionnelles		
tarde_lois_imitation_2.pdf	91	général, est non seulement imitatif, mais passif dans sa manière d'imiter. - Quoi qu'il		
tarde_lois_imitation_2.pdf	91	tous les peuples par imitation d'un voisin longtemps avant que ne leur fût venu le goût		
tarde_lois_imitation_2.pdf	91	nouvelle religion. - Semblablement, les peuples aiment, par imitation, la gloire		
tarde_lois_imitation_2.pdf	92	se prolonger indéfiniment. - La passivité imitative de l'homme a donc eu cet heureux		
tarde_lois_imitation_2.pdf	94	en Phénicie, en Grèce, à Babylone. Si elles s'étaient propagées, par imitation-mode,		
tarde_lois_imitation_2.pdf	97	un âge d'expansion imitative, quand tout l'archipel et toute l'Asie Mineure		
tarde_lois_imitation_2.pdf	97	suggérée. Puisque chaque invention est le foyer d'une imitation particulière qui en		
tarde_lois_imitation_2.pdf	98	eux-mêmes sont si imitateurs qu'il y a, à chaque époque, un courant d'inventions dans		
tarde_lois_imitation_2.pdf	101	1   C'est par imitation que les plébéiens de Rome se sont assimilés aux patriciens. D'après Vico, la		
tarde_lois_imitation_2.pdf	113	d'un imitateur quelconque sous la forme d'une croyance ou d'une aspiration, d'une		
tarde_lois_imitation_2.pdf	113	neuves, permettent aux races les plus inventives à la fois et les plus imitatives de		
tarde_lois_imitation_2.pdf	117	des nations civilisées quand elles se battent entre elles? Par la diffusion imitative,		
tarde_lois_imitation_2.pdf	120	d'établir. L'ordre des invention successives et l'ordre des imitations successives font		
tarde_lois_imitation_2.pdf	120	deux, bien que imitation signifie invention imitée. Les lois, en effet, qui régissent la		
tarde_lois_imitation_2.pdf	122	toutes ses fonctions imitatives, mais ne les ferait point rétroagir. - Nous lisons dans		
tarde_lois_imitation_2.pdf	124	une égalisation de plus en plus grande. Car l'assimilation imitative n'est que l'étoffe		
tarde_lois_imitation_2.pdf	125	    ment opérées par imitation d'un modèle prestigieux, qu'il s'agisse du prestige d'un conquérant ou		
tarde_lois_imitation_2.pdf	125	    conscient imitateur des Césars, est une crise génétique ; ces ténèbres sont « une aurore ». Tout lui		
tarde_lois_imitation_2.pdf	125	    qu'il en ait, soit qu'il n'en ait pas conscience, soit qu'il cède à un entraînement dit imitatif, soit qu'il		
tarde_lois_imitation_2.pdf	126	    complication sociale, de mutuelle imitation harmonieuse. Mais, même sans la conquête de Rome,		
tarde_Monadologie_et_socio.pdf	52	condensation a-t-il diminué ? Non, ses imitateurs ne sont pas ses rivaux seule-		
tarde_Opposition_universelle.pdf	5	rationnel. Lois de leur propagation imitative. - V. Subordination de l'ordre au progrès,		
tarde_Opposition_universelle.pdf	5	ment un nombre donné de similitudes imitatives, spirituelles, fussent-elles simple-		
tarde_Opposition_universelle.pdf	6	sympathie imitative. - III. Le problème religieux. Guyau et l'Irréligion de l'avenir.		
tarde_Opposition_universelle.pdf	29	répandent ensuite de tous côtés en rayonnement imitatif. On voit que la vie et		
tarde_Opposition_universelle.pdf	36	lation ou gravitation, génération, imitation, - deviendrait impossible, et, avec		
tarde_Opposition_universelle.pdf	48	vidus par imitation rayonnante de modèles communs multiplie les exemplaires		
tarde_Opposition_universelle.pdf	48	de ces éditions imitatives en tout genre d'idée ou d'action, de consommations		
tarde_Opposition_universelle.pdf	53	et à refaire. J'ai remarqué ailleurs que le travail est essentiellement imitation,		
tarde_Opposition_universelle.pdf	56	     les répétitions physiques. Pour moi, le rayonnement imitatif qui d'un coin de peuplade a		
tarde_Opposition_universelle.pdf	57	répète (par ondulation, par hérédité, par imitation, ou par les trois procédés à		
tarde_Opposition_universelle.pdf	74	la main droite pour la couture, ce n'est point certainement par imitation de la		
tarde_Opposition_universelle.pdf	122	ment de tout contact et de tout emprunt imitatifs, certaines conceptions		
tarde_Opposition_universelle.pdf	125	maladive si elle ne s'expliquait par la même contagion imitative. Il en est de		
tarde_Opposition_universelle.pdf	127	mutuelle de leurs exemples, et s'il est vrai que cette assimilation imitative est		
tarde_Opposition_universelle.pdf	128	c'est en imitant les voisins qu'ils admirent ou en se gardant d'imiter les voisins		
tarde_Opposition_universelle.pdf	131	tendance physiologique à la répétition imitative des mouvements, des gestes		
tarde_Opposition_universelle.pdf	150	té, les peuples sont initiateurs-nés ou imitateurs-nés de leurs voisins; ils peu-		
tarde_Opposition_universelle.pdf	150	vent être imitateurs d'idées quoiqu'initiateurs d'actes, comme les Romains, ou,		
tarde_Opposition_universelle.pdf	158	                 Variation, imitation, variation inverse 		
tarde_Opposition_universelle.pdf	165	vernement ancien n'eût suscité la conception, à la fois imitative et inventive,		
tarde_Opposition_universelle.pdf	171	qui favorisent la diffusion imitative des unes au détriment des autres, toutes		
tarde_Opposition_universelle.pdf	172	sées des individus ordinaires, imitatifs, présentant de faibles différences en		
tarde_Opposition_universelle.pdf	173	rayonnement imitatif de celles-ci se répand parmi les individualités dites		
tarde_Opposition_universelle.pdf	174	par l'extension imitative du champ social, en revanche les ressources mises à		
tarde_Opposition_universelle.pdf	176	l'addition, grâce à la propagation imitative, la combinaison, grâce à la logique.		
tarde_Opposition_universelle.pdf	176	états d'âme, pour que la propagation imitative de chacun de ces états devint		
tarde_Opposition_universelle.pdf	177	nomènes vivants, ou la sympathie 1, cause de la répétition imitative des actes		
tarde_Opposition_universelle.pdf	181	les procédés directs ou indirects à sa portée, la propagation imitative d'une		
tarde_Opposition_universelle.pdf	181	mauvaises pour décourager leurs imitateurs éventuels. À l'appui de cette		
tarde_Opposition_universelle.pdf	182	propagation imitative, année par année, de chaque production industrielle ou		
tarde_Opposition_universelle.pdf	186	nent son imitation, tend toujours à croître par elle-même, comme le besoin qui		
tarde_Opposition_universelle.pdf	186	    figurant toujours, au fond, des propagations imitatives, étaient la partie essentielle à		
tarde_Opposition_universelle.pdf	187	propagation imitative, les salaires, quand ils décroissent, décroissent bien		
tarde_Opposition_universelle.pdf	187	capitaux 	 ces causes, en définitive, se réduisent à des propagations imitatives,	
tarde_Opposition_universelle.pdf	187	    sion imitative, tout ou partie de leur domaine. Or, entre les phénomènes imitatifs,		
tarde_Opposition_universelle.pdf	188	toujours bien moins contagieuse que son imitation. Aussi je suis bien disposé		
tarde_Opposition_universelle.pdf	188	de la propagation imitative des inventions civilisatrices qui tendent à opérer le		
