foucault_disciplineandpunish_1977.pdf	131	tempted to imitate them, ‘but also to correct themselves and to		
foucault_disciplineandpunish_1977.pdf	146	repeat, or imitate one another, support one another, distinguish		
foucault_disciplineandpunish_1977.pdf	162	 the whole of Europe imitated after the victories of Frederick II	4 the	
foucault_disciplineandpunish_1977.pdf	219	 there being any imitation or copying), to map aptitudes, to assess		
foucault_disciplineandpunish_1977.pdf	278	which the convict exhorted the crowd never to imitate him, was		
foucault_disciplineandpunish_1977.pdf	318	the law, the punishments imitate the verdicts and penalties, the		
Foucault_Michel_Archaeology_of_Knowledge.pdf	152	in the same way) and imitative statements (which receive and repeat		
foucault_power_1978.pdf	6	not duplicate society, just as society does not imitate the      are a shelter for power, anchoring its prohibitions; but they		
Foucault_The-Order-of-Things.pdf	44	ity of the person seeing – despite all mirrors, reﬂections, imitations,		
Foucault_The-Order-of-Things.pdf	46	stems the secrets that were of use to man. Painting imitated space. And		
Foucault_The-Order-of-Things.pdf	49	   lation enables things to imitate one another from one end of the uni-		
Foucault_The-Order-of-Things.pdf	79	   model, and one that it imitates in the most servile way	 it is to be found	
Foucault_The-Order-of-Things.pdf	145	    alternatives of natural imitation and arbitrary convention. In that which		
Foucault_The-Order-of-Things.pdf	197	         stance is ﬂint inside. The form of a heart is imitated as perfectly as		
Foucault_The-Order-of-Things.pdf	343	    it does so not in so far as it is an imitation and duplication of things,		
Foucault_The-Order-of-Things.pdf	424	one ﬁnds oneself imitating the philosophical posture of the eighteenth		
Futurepublic_Info_Warfare_Bio-racism_Hegemony.pdf	11	  r, ‘there is simply nothing to identify with or imitate. . . . The alerts		
Gibson_animals_2002.pdf	1	  ing, imitation, speech, and gesture demand brain-size mediated neurological		
Gibson_animals_2002.pdf	1	uage, making complex tools, art, dance, mime, teaching and imitation. These		
Gibson_animals_2002.pdf	9	ntactic capacities, imitative capacities, and social intelligence (Gibson, 1990,		
Gibson_animals_2002.pdf	10	tions via teaching, language, demonstration, and imitation.		
Gibson_animals_2002.pdf	10	 in imitative and teaching domains (Byrne, 1995; Byrne and Russon, 1998), but they		
Gibson_animals_2002.pdf	12	eloped imitative skills by that time period (Mithen, 1999). Some argue that the		
grant_schelling_2006.pdf	70	   Heraclitean flux, a ‘bodily imitation of that which was to be expressed’, and in the VIIth		
grant_schelling_2006.pdf	167	     shape imitate the higher organic world. ‘The whole kindgom of metals’, he [Schubert]		
grant_schelling_2006.pdf	194	    If philosophy’s first construction is the imitation of an original, all its		
grant_schelling_2006.pdf	194	    constructions will likewise be merely such imitations. So long as the Ich		
kellner-bush2-2005.pdf	25	     20/20 and CBS’s West 57th Street and then 60 Minutes Two appeared, which imitated CBS’s		
Kelty-TwoBits_2008.pdf	27	tion of canons, the interplay of imitation and originality, and the		
Kelty-TwoBits_2008.pdf	201	effect	 their users, not knowing that they are using an imitation of	
Kelty-TwoBits_2008.pdf	201	urge everyone to refer to a nonextensible imitation of EMACS as an		
Kelty-TwoBits_2008.pdf	202	    modify it, instead of imitating it. For Stallman, this was not only		
Kelty-TwoBits_2008.pdf	204	    imitators refer to their versions of EMACS as ersatz EMACS, few		
Kelty-TwoBits_2008.pdf	204	    imitation, and then called it something else (EINE and ZWEI were		
Kelty-TwoBits_2008.pdf	204	    went on, EMACS was ported, forked, rewritten, copied, or imitated		
Kelty-TwoBits_2008.pdf	254	    ing, rewriting, and imitation. UNIX was not created de novo, but		
Kelty-TwoBits_2008.pdf	323	its thousands of versions and imitations and reimplementations.		
LatoourTARDE-CANDEA_2009.pdf	2	believing that this should be done through a superficial imitation of the natural		
LatoourTARDE-CANDEA_2009.pdf	3	       The paradox is that it is Durkheim who imitates the natural sciences while		
LatoourTARDE-CANDEA_2009.pdf	5	crimes imitate one another. They have to learn from one another, modus operandi		
LatoourTARDE-CANDEA_2009.pdf	5	1890.xi Nevertheless, it is important to understand that imitation is not an		
LatoourTARDE-CANDEA_2009.pdf	6	stabilized by imitation and made available in a new form, such as a code, a		
LatoourTARDE-CANDEA_2009.pdf	7	the individual agent to imitate others. What we observe either in individual		
LatoourTARDE-CANDEA_2009.pdf	15	viii 	 “Il en résulte que la contagion imitative de cette corporation antisociale	
LatoourTARDE-CANDEA_2009.pdf	15	x In Laws of imitation Tarde claims that the best way to detect those		
Latour-body-2004.pdf	13	 tific’ facts and imitated the great solidity of the natural sciences! The only		
Latour_critical_inquiry_2004.pdf	4	    existed; what is new in instant revisionism is how much scientiﬁc proof they claim to imitate.		
Latour_lepinay-TARDE-2008.pdf	6	« rayons imitatifs » dans son livre, LES LOIS DE L’IMITATION, qui va le rendre		
Latour_lepinay-TARDE-2008.pdf	20	          des inventions, et les lois de leurs imitations. Le progrès économique suppose deux		
Latour_lepinay-TARDE-2008.pdf	24	 par imitation de la génétique —science du « gène »— se réclame aussi de Tarde. Susan		
Latour_lepinay-TARDE-2008.pdf	33	41 C’est cet intérêt pour le contenu des imitations qui explique l’intérêt que certains cogniticiens		
Latour_Tarde_2010.pdf	2	believing that this should be done through a superficial imitation of the natural		
Latour_Tarde_2010.pdf	3	       The paradox is that it is Durkheim who imitates the natural sciences while		
Latour_Tarde_2010.pdf	5	crimes imitate one another. They have to learn from one another, modus operandi		
Latour_Tarde_2010.pdf	5	1890.xi Nevertheless, it is important to understand that imitation is not an		
Latour_Tarde_2010.pdf	6	stabilized by imitation and made available in a new form, such as a code, a		
Latour_Tarde_2010.pdf	7	the individual agent to imitate others. What we observe either in individual		
Latour_Tarde_2010.pdf	15	viii 	 “Il en résulte que la contagion imitative de cette corporation antisociale	
Latour_Tarde_2010.pdf	15	x In Laws of imitation Tarde claims that the best way to detect those		
Latour_war_2002.pdf	7	alism or voluntarily imitating a cultural model, but   tasted, nor could they provide any truly human signi-		
Latour_war_2002.pdf	26	first presentation is not negotiable and to oppose it is representative democracy—even if imitation often		
latour_why_has_critique_2004.pdf	5	  existed; what is new in instant revisionism is how much scientiﬁc proof they claim to imitate.		
lazzarato_biopolitics.pdf	15	schools, the education that the students acquire on their own, by imitating each other, by		
lazzarato_videophil_2007.pdf	3	e, then the technologies that I am concerned with should imitate the		
lazzarato_videophil_2007.pdf	14	cause, although the technologies of time can only imitate these forms of		
lazzarato_videophil_2007.pdf	19	ies of time imitate the various syntheses (conservation, passage and		
lazzarato_videophil_2007.pdf	20	oduction of synthesis-images imitate in the most ‘faithful’ way ‘the circuit’		
Leach_Tarde_2010.pdf	4	                  gists study. His focus on imitation and repetition that might have effects in social		
Leach_Tarde_2010.pdf	4	                      successful imitations are numerous indeed, but how few are they in comparison		
Leach_Tarde_2010.pdf	4	                  ethnographer themselves. The imitations and innovations are to have their effect		
Leach_Tarde_2010.pdf	5	               they considered such activities distractions from the ‘work’ of imitation	 of ritually	
Leach_Tarde_2010.pdf	7	               moments as imitations, but specifically as imitations of cultural practices adopted		
Leach_Tarde_2010.pdf	7	               moments as imitations, but specifically as imitations of cultural practices adopted		
Leach_Tarde_2010.pdf	8	                  This reaffirms the more general point that imitation goes from the heart of things		
Leach_Tarde_2010.pdf	8	                  to the outer trappings, because imitation for Tarde is inter-subjectivity and not just		
Leach_Tarde_2010.pdf	10	                  influencing them, we looked at the everyday minute interactions in which imitation		
Leach_Tarde_2010.pdf	10	                  played a large role – imitation by newer and less well-known programmers of the		
Leach_Tarde_2010.pdf	11	               understandings or principles that guide action because of imitation and precedent,		
Leach_Tarde_2010.pdf	11	               also, that we had hit on some of the behaviours being imitated in the actions of		
Leach_Tarde_2010.pdf	13	                  Back to Tarde then	 he says we must focus on the moments of imitation and dif-	
Leach_Tarde_2010.pdf	13	               what it is that people are doing in their imitations and differences from one another,		
Leach_Tarde_2010.pdf	14	                  took up the Tardian emphasis on two core elements of social life, imitation and		
Lee_peoples_publics.pdf	18	               imitates Life, Time, L’Express, and Der Spiegel, while ai yue (Philharmonic), the		
Lepin_tarde_vibration_2007.pdf	5	                                                                         imitative rays in the associated brains and that it is really there, the		
Lepin_tarde_vibration_2007.pdf	6	                                                                       of encounters and interferences of imitative rays to use Tarde’s terms. To		
Lepin_tarde_vibration_2007.pdf	12	                                                                         Labour is a continuous stream of imitation, a periodic series of acts tied		
Lepin_tarde_vibration_2007.pdf	13	                                                                         is imitation and reproduction in economic work [ . . .] Finality is essential to		
lury_topology_Theory_Culture_Society-2012-Lury-3-35.pdf	18	fuse, diﬀerential processes of imitation and invention. More geometrico,		
mackenzie_black_scholes.pdf	30	‘reality will eventually imitate theory’ (Merton, 1992	 470; see Merton,	
Manovich_digital_humanities_2012.pdf	66	                  is able to re-create and imitate other formats. But it also allows content to be		
manovich_softbook_11_20_2008.pdf	31	documents which imitate paper. (And even at the		
manovich_softbook_11_20_2008.pdf	33	computers imitate older media. By developing easy		
manovich_softbook_11_20_2008.pdf	35	contemporary computational media imitates other		
manovich_softbook_11_20_2008.pdf	35	Neumann about computers imitating other media		
manovich_softbook_11_20_2008.pdf	37	does imitate in appearance traditional photography.		
manovich_softbook_11_20_2008.pdf	42	another article, his idea was not to simply imitate		
manovich_softbook_11_20_2008.pdf	63	medium is invented, it first closely imitates already		
manovich_softbook_11_20_2008.pdf	63	Guttenberg closely imitated the look of the		
manovich_softbook_11_20_2008.pdf	64	from an imitation of older media to finding its own		
manovich_softbook_11_20_2008.pdf	147	created to imitate work with different physical media		
manovich_softbook_11_20_2008.pdf	187	time. Driven less by the desire to imitate vernacular		
manovich_softbook_11_20_2008.pdf	228	passionately imitating it. That is, they now make		
marx_Capital-Volume-I.pdf	12	remained mere schoolboys, imitators and followers, petty retailers and hawkers in the service of		
marx_Capital-Volume-I.pdf	351	the Basedows and their modern imitators) ―leaves the children‘s minds silly,‖ (―Proposals for Raising		
marx_Capital-Volume-I.pdf	398	necessary, and he is far away from imitating those brutal South Americans, who force their		
Massumi_Fear_(the_Spectrum_Said)_-_Positions.pdf	2	                        people began to act similarly, as in social imitation of each other, or of a		
Massumi_Fear_(the_Spectrum_Said)_-_Positions.pdf	2	                           There was simply nothing to identify with or imitate. The alerts presented		
Massumi_Fear_(the_Spectrum_Said)_-_Positions.pdf	4	                        as an activation contour lacking deﬁnite content or imitable form meant		
mills_cybernetic_hearing_2011.pdf	28	                      because it was already “possible to make machinery to imitate any small		
Mills_Intell_Craft.pdf	10	who use it believe they are imitating `physical science,' and are not aware that much of that prose is not altogether necessary. It		
mitchell-no-visual-media2005.pdf	3	the moment the fact that a painter can do an excellent job of imitating the		
mitchell-no-visual-media2005.pdf	3	niques can, similarly, imitate the painterly surface and sfumato of a painter.)		
Myers_animating_mech_2006PublishedSS.pdf	17	biomolecules become intelligible, ma-          both an element of copy or imitation, as		
Myers_animating_mech_2006PublishedSS.pdf	17	ity”, in which movement, sensation and         imitate, make models, explore differ-		
nettime-software.pdf	10	                             The semantic search engines imitate this accumulation by typifying con-		
nettime-work.pdf	6	                          Tarde, every activity is a combination of imitative and inventive labor, but		
noble_postmodern-prog-CS-TR-02-9.pdf	21	of imitators	 many mediocre, some less so, none as successful as the original,	
Norris_Diagonals_2012.pdf	30	 deceptive, or imitation speech-acts—by applying a strict		
OA_Version_Speculative_Turn_9780980668346.pdf	139	lemma with the hope for a god that would be ‘desirable, lovable, worthy of imitation’		
OA_Version_Speculative_Turn_9780980668346.pdf	335	             existences77 or pseudo-realities are real; but false in that they formally imitate the status of		
OA_Version_Speculative_Turn_9780980668346.pdf	351	sion, imitation, concurrence, juxtaposition, or identification. The theoretical domina-		
OA_Version_Speculative_Turn_9780980668346.pdf	374	ical foundation capable of preventing it. Far from imitating the flight of birds, the		
OA_Version_Speculative_Turn_9780980668346.pdf	414	tions? Richerson and Boyd argue that between group imitation can also be a factor		
osborne-creativity-2003.pdf	5	ativity as such but imitation. ‘Imitators imitate one another, and that’s		
osborne-creativity-2003.pdf	5	ativity as such but imitation. ‘Imitators imitate one another, and that’s		
osborne-creativity-2003.pdf	6	 ome unknown’ (Deleuze and Parnet 1987	 45). Those who imitate are those	
osborne-creativity-2003.pdf	6	 manent imitation – production for the sake of production, ‘ideas’ for the sake		
osborne-creativity-2003.pdf	13	ents of mere imitation – but he is still happy to invoke, in the name of		
Osborne_what_is_problem_2003.pdf	14	im of history was to invoke differences not possibilities of imitation. As Paul		
pang_counterfeit_china_2008.pdf	4	ment. However, it was a poor imitation of the American action, as the		
parikka_ephemera_2007.pdf	6	According to the idea, culture is based on copying and imitation, which are governed by		
parikka_ephemera_2007.pdf	9	spread and evolve via imitation.		
parikka_ephemera_2007.pdf	13	     epidemic social relations, working via imitation and repetition. See Tarde, G. (2000) Social Laws	 An	
parikka_ephemera_2007.pdf	13	     imitation’, Journal of Memetics	 Evolutionary Models of Information Transmission, 4 [http	//jom-
parikka_ephemera_2007.pdf	14	Turing machine as an imitation machine. The Turing Machine, the formal model of		
priestley_science_operations_2011.pdf	155	memory as “absolutely general in the sense that it could be made to imitate any		
priestley_science_operations_2011.pdf	195	the machine, or as a way of making the machine imitate another machine which		
protevi_review_Deleuze_social_2009.pdf	3	invention  and  imitation  at  the  level  of  “brains”),  the  society  of  control  captures  and 		
Riskin_-_Duck.pdf	4	anism and the imitation in seventeenth- and early eighteenth-century au-		
Riskin_-_Duck.pdf	4	and the imitative ﬁgures all on top. But, even in cases where the mechanism		
Riskin_-_Duck.pdf	4	    By the late eighteenth century, automata were imitative internally as well		
Riskin_-_Duck.pdf	8	living things. By imitating the stuﬀ of life, automaton makers were once		
Riskin_-_Duck.pdf	11	rounded by plenty of genuine imitation. Vaucanson was intent on making		
Riskin_-_Duck.pdf	11	over four hundred articulated pieces, imitating every bump on every bone		
Riskin_-_Duck.pdf	12	important, was his organizing assumption that the imitation of life’s inner		
Riskin_-_Duck.pdf	12	Condorcet did not believe in the digestive part of the imitation, but he wrote		
Riskin_-_Duck.pdf	17	of sound in the ﬂute “by imitating the same Mechanism in an Automa-		
Riskin_-_Duck.pdf	17	the ﬂute was a deliberately unlikely choice for a mechanical imitation. Vau-		
Riskin_-_Duck.pdf	18	player made manifest both the constraints upon mechanical imitation and		
Riskin_-_Duck.pdf	18	one could imitate mechanically. The pipe, unlike the ﬂute, had a ﬁxed ap-		
Riskin_-_Duck.pdf	19	automata to gauge the limits of the mechanical imitation of life, and in the		
Riskin_-_Duck.pdf	19	be imitable.” The result was a contraption consisting of a resonating box		
Riskin_-_Duck.pdf	28	for the sake of imitation and experimentation, such as Kempelen’s talking		
Riskin_-_Duck.pdf	34	“vital functions that mechanics [could] imitate” were respiration and di-		
Riskin_-_Duck.pdf	34	    70. J. A. Borgnis, Des machines imitatives et théatrales, vol. 8 of Traité complet de mécanique		
Riskin_-_Duck.pdf	35	build multiply imitative automata that would “fulﬁl the thousand services		
RP_156.pdf	13	painting can only imitate by artistic means.                ible in his work, like God in his creation. But it would		
sedgwick_ek_shame_fold_1995.pdf	5	     imitate me, we can enjoy each other. [AIC, 1	411-12]	
shaviro-erotic-machines.pdf	4	        expressionism and lm noir for colour  lm; he and all his imitators in science  ction		
space_and_culture2979.pdf	38	ishes, imitation cast iron atria, and bountiful displays of commodities. The emphasis		
space_and_culture2979.pdf	39	       nized and much imitated architectural style that has become a part of the urban and		
staeheli_lists_2013.pdf	12	                                                                        produce more lists. We can use Gabriel Tarde’s theory of imitation for understanding		
staeheli_lists_2013.pdf	12	                                                                        the contagious nature of list-making. Lists themselves are imitated. They are not		
sterne-bourdieu-technology.pdf	14	   imitations; they vary especially between societies, educations, proprieties		
sterne-sound.pdf	2	    on imitations of the mouth to imitations of the ear. Through the  gure of the ear		
sterne-sound.pdf	2	    on imitations of the mouth to imitations of the ear. Through the  gure of the ear		
sterne-sound.pdf	6	    simply understood to imitate sound but were themselves understood by their		
sterne-sound.pdf	6	    inventors and early users as an imitation of the process of hearing. Not only were		
sterne-sound.pdf	7	partially imitating the processes of the human ear. Like the ear, this machine		
sterne-sound.pdf	7	4). This imitation of the ear was not lost on other inventors. Bell and Blake’s 1874		
sterne-sound.pdf	12	    sought to better imitate that ear function. When he conveyed this idea to his		
sterne-sound.pdf	18	    preserve or imitate sound (even the simplest instruction books for early tele-		
sterne-sound.pdf	18	    imitate speech that imitated the processes by which sound is produced. Later		
sterne-sound.pdf	19	       was certainly nothing else but Mathematical Inventions framed in imitation		
sterne-sound.pdf	19	experiments with an imitation of the mouth is instructive.		
sterne-sound.pdf	21	graph and automata; between machines that imitate sound and machines that		
sterne-sound.pdf	21	      The automaton and the diaphragm effect the imitation of sound through two		
sterne-sound.pdf	23	this notion of the imitation of the ear, and speci cally around machines that used		
sterne-sound.pdf	23	teenth century innovation, its central thread – the diaphragm and the imitation		
sterne-sound.pdf	23	takes the imitation of the human ear quite literally in his account. Commenting		
sterne-sound.pdf	26	    sound technologies were at once supplements to, imitations of, and replacements		
sterne-sound.pdf	26	    connects ear to machine through analogy, imitation, or thumbscrews. This con-		
sterne-sound.pdf	28	    same is true with the tympanic diagram	 it begins as an imitation of the human	
sterne-sound.pdf	28	    quickly turn away from literal imitations of the human ear, since, for instance,		
stewart_cultural_poesis.pdf	5	           the letter, pushing it to the point of imitation or		
stiegler-technics-2003.pdf	5	condemned in the Republic as mere imitators           temporality, I call this becoming [le devenir].		
strathern-1995.pdf	7	transported from Los Angeles to Tokyo, in turn, is neither imitation nor reproduction		
streeter-romantic-self-internet.pdf	6	r-function, to draw the line between original works and ideas and imitative		
tarde_les_lois_sociales.pdf	19	qu'il consiste toujours, originairement en une imitation de l'une par l'autre. Mais il		
tarde_les_lois_sociales.pdf	20	     Ainsi, le caractère constant d'un fait social, quel qu'il soit, est bien d'être imitatif.		
tarde_les_lois_sociales.pdf	20	     Mais il ne suffit point de reconnaître ce caractère imitatif de tout phénomène		
tarde_les_lois_sociales.pdf	20	     même homme, imitation interne que j'avais déjà moi-même appelée habitude, et qui, évidemment,		
tarde_les_lois_sociales.pdf	21	tradition, imitation des ancêtres, exercent une pression si souvent tyrannique, encore		
tarde_les_lois_sociales.pdf	25	l'attraction prêtée à ces imitations d'homme à homme, qui donnent l'explication analy-		
tarde_les_lois_sociales.pdf	25	qui régissent la répétition imitative et qui sont à la sociologie ce que les lois de		
tarde_les_lois_sociales.pdf	26	s'agit a trouvé à se satisfaire par cette répétition imitative, qui évite à leur paresse		
tarde_les_lois_sociales.pdf	26	rence de rayonnements imitatifs a lieu en lui, de rayonnements imitatifs qui, à partir		
tarde_les_lois_sociales.pdf	27	l'opposition sociale. -Ajoutons que les interférences des rayonnements imitatifs ne		
tarde_les_lois_sociales.pdf	37	il faut que cette négation - non pas adoptée imitativement, mais au contraire repous-		
tarde_les_lois_sociales.pdf	37	préférable à l'autre dans la circonstance donnée 	 ici ce sont deux rayons imitatifs qui	
tarde_les_lois_sociales.pdf	37	encore une fois, un rayon imitatif; la totalité de rayons de ce genre qui s'échappent		
tarde_les_lois_sociales.pdf	38	il n'y a qu'un seul rayon imitatif, qui, par son maître d'école, le rattache à Galilée.		
tarde_les_lois_sociales.pdf	38	propage ni ne tend à se propager imitativement chez ses proches ; dans ce cas, le		
tarde_les_lois_sociales.pdf	39	de se répandre imitativement. S'il en était autrement, il faudrait dire qu'il n'y a rien de		
tarde_les_lois_sociales.pdf	40	raréfaction graduelle. Par suite du rayonnement imitatif, en effet, qui travaille inces-		
tarde_les_lois_sociales.pdf	41	rayonnement imitatif - fluviatile, puis méditerranéenne, la civilisation devient océani-		
tarde_les_lois_sociales.pdf	47	dé industriel, etc., tendent à se propager géométriquement par répétition imitative,		
tarde_les_lois_sociales.pdf	47	répand et se fortifie et tend par la rencontre de l'un de ses rayons imitatifs avec un		
tarde_les_lois_sociales.pdf	47	propagation imitative de l'état d'harmonie à la fois interne et externe réalisé par		
tarde_les_lois_sociales.pdf	48	j'extrais cette citation, il étend le mot imitation bien au-delà de l'acceptation que je lui		
tarde_les_lois_sociales.pdf	49	répétitions circulaires, que nous nommons imitation, est un type fondamental,		
tarde_les_lois_sociales.pdf	52	ou imitation), comme l'opposition avec soi (hésitation, doute) diffère de l'opposition		
tarde_les_lois_sociales.pdf	57	gressif ne doit pas s'entendre ici de la tendance à la diffusion imitative d'une invention		
tarde_les_lois_sociales.pdf	57	production par lesquels elle y répond, se propagent par imitation au-delà de la région,		
tarde_les_lois_sociales.pdf	58	le progrès d'une invention en extension par sa propagation imitative, et son progrès en		
tarde_les_lois_sociales.pdf	58	progressions, la progression imitative, uniformisante, et la progression inventive,		
tarde_les_lois_sociales.pdf	59	entre deux rayonnements imitatifs, quelle qu'elle soit, elle est toujours transparente		
tarde_les_lois_sociales.pdf	63	son rayonnement imitatif dans sa sphère plus ou moins bornée, mais qui suffit à		
tarde_les_lois_sociales.pdf	64	impériosité actuelle s'est établie, le tout par propagation imitative. Il en est de même		
tarde_les_lois_sociales.pdf	67	répétition héréditaire et habituelle du monde vivant, ou de la répétition imitative du		
tarde_les_lois_sociales.pdf	67	ou se produit, par une interférence de rayons imitatifs venus du dehors, une contradic-		
tarde_les_lois_sociales.pdf	68	élémentaire est le fait individuel du premier imitateur, point de départ d'une immense		
